{
  "schema_version": "claim_validation_policy_v1",
  "policy_version": "claim_validation_policy_v1",
  "status": "FROZEN",
  "status_taxonomy_version": "claim_validation_status_taxonomy_v1",
  "reason_code_taxonomy_version": "claim_validation_reason_codes_v1",
  "numeric_policy_version": "numeric_tolerance_policy_v1",
  "direction_normalization": {
    "increase_risk": "increase_risk",
    "decrease_risk": "decrease_risk",
    "increases_risk": "increase_risk",
    "decreases_risk": "decrease_risk",
    "mixed": "mixed",
    "neutral": "neutral",
    "unknown": "unknown"
  },
  "near_zero_shap_epsilon": 1e-12,
  "evidence_exposure_boundary": {
    "validation_source": "canonical_evidence_package",
    "hidden_IR_prohibited": true,
    "s0": {
      "exposed_claim_families": [
        "PREDICTION"
      ],
      "unexposed_claim_families": [
        "FEATURE",
        "CONCEPT",
        "DIRECTION",
        "MAGNITUDE",
        "RANKING"
      ],
      "unexposed_behavior": "UNSUPPORTED_WITH_EXPOSURE_REASON"
    }
  },
  "one_result_per_claim": true,
  "unresolved_join_behavior": "ERROR",
  "unsupported_claim_type_behavior": "ERROR",
  "claim_type_routing": [
    {
      "claim_type": "prediction",
      "validator_family": "PREDICTION",
      "allowed_statuses": [
        "SUPPORTED",
        "UNSUPPORTED",
        "CONTRADICTED",
        "NOT_VERIFIABLE"
      ],
      "allowed_reason_families": [
        "MATCH",
        "PREDICTION",
        "POLICY"
      ],
      "required_expected_fields": [
        "prediction_label",
        "exposure_status"
      ],
      "required_observed_fields": [
        "prediction_label",
        "exposure_status"
      ],
      "not_applicable_allowed": false,
      "hard_safety_failure_possible": true
    },
    {
      "claim_type": "feature_presence",
      "validator_family": "FEATURE",
      "allowed_statuses": [
        "SUPPORTED",
        "UNSUPPORTED",
        "CONTRADICTED",
        "NOT_VERIFIABLE"
      ],
      "allowed_reason_families": [
        "MATCH",
        "EXPOSURE",
        "FEATURE"
      ],
      "required_expected_fields": [
        "feature_id",
        "exposure_status"
      ],
      "required_observed_fields": [
        "feature_id",
        "exposure_status"
      ],
      "not_applicable_allowed": false,
      "hard_safety_failure_possible": false
    },
    {
      "claim_type": "feature_direction",
      "validator_family": "DIRECTION",
      "allowed_statuses": [
        "SUPPORTED",
        "UNSUPPORTED",
        "CONTRADICTED",
        "NOT_VERIFIABLE"
      ],
      "allowed_reason_families": [
        "MATCH",
        "EXPOSURE",
        "FEATURE",
        "DIRECTION"
      ],
      "required_expected_fields": [
        "feature_id",
        "direction",
        "exposure_status"
      ],
      "required_observed_fields": [
        "feature_id",
        "direction",
        "exposure_status"
      ],
      "not_applicable_allowed": false,
      "hard_safety_failure_possible": false
    },
    {
      "claim_type": "concept_presence",
      "validator_family": "CONCEPT",
      "allowed_statuses": [
        "SUPPORTED",
        "UNSUPPORTED",
        "CONTRADICTED",
        "NOT_VERIFIABLE"
      ],
      "allowed_reason_families": [
        "MATCH",
        "EXPOSURE",
        "CONCEPT"
      ],
      "required_expected_fields": [
        "concept_id",
        "exposure_status"
      ],
      "required_observed_fields": [
        "concept_id",
        "exposure_status"
      ],
      "not_applicable_allowed": false,
      "hard_safety_failure_possible": false
    },
    {
      "claim_type": "concept_direction",
      "validator_family": "DIRECTION",
      "allowed_statuses": [
        "SUPPORTED",
        "UNSUPPORTED",
        "CONTRADICTED",
        "NOT_VERIFIABLE"
      ],
      "allowed_reason_families": [
        "MATCH",
        "EXPOSURE",
        "CONCEPT",
        "DIRECTION"
      ],
      "required_expected_fields": [
        "concept_id",
        "direction",
        "exposure_status"
      ],
      "required_observed_fields": [
        "concept_id",
        "direction",
        "exposure_status"
      ],
      "not_applicable_allowed": false,
      "hard_safety_failure_possible": false
    },
    {
      "claim_type": "magnitude",
      "validator_family": "MAGNITUDE",
      "allowed_statuses": [
        "SUPPORTED",
        "UNSUPPORTED",
        "CONTRADICTED",
        "NOT_VERIFIABLE"
      ],
      "allowed_reason_families": [
        "MATCH",
        "EXPOSURE",
        "MAGNITUDE",
        "POLICY"
      ],
      "required_expected_fields": [
        "magnitude",
        "exposure_status"
      ],
      "required_observed_fields": [
        "magnitude",
        "exposure_status"
      ],
      "not_applicable_allowed": false,
      "hard_safety_failure_possible": false
    },
    {
      "claim_type": "ranking",
      "validator_family": "RANKING",
      "allowed_statuses": [
        "SUPPORTED",
        "UNSUPPORTED",
        "CONTRADICTED",
        "NOT_VERIFIABLE"
      ],
      "allowed_reason_families": [
        "MATCH",
        "EXPOSURE",
        "RANKING"
      ],
      "required_expected_fields": [
        "rank",
        "exposure_status"
      ],
      "required_observed_fields": [
        "rank",
        "exposure_status"
      ],
      "not_applicable_allowed": false,
      "hard_safety_failure_possible": false
    },
    {
      "claim_type": "numeric",
      "validator_family": "NUMERIC",
      "allowed_statuses": [
        "SUPPORTED",
        "UNSUPPORTED",
        "CONTRADICTED",
        "NOT_VERIFIABLE"
      ],
      "allowed_reason_families": [
        "MATCH",
        "EXPOSURE",
        "NUMERIC"
      ],
      "required_expected_fields": [
        "numeric_value",
        "numeric_role",
        "exposure_status"
      ],
      "required_observed_fields": [
        "numeric_value",
        "numeric_role",
        "exposure_status"
      ],
      "not_applicable_allowed": false,
      "hard_safety_failure_possible": false
    },
    {
      "claim_type": "causal",
      "validator_family": "POLICY",
      "allowed_statuses": [
        "SUPPORTED",
        "UNSUPPORTED",
        "CONTRADICTED",
        "NOT_VERIFIABLE",
        "NOT_APPLICABLE"
      ],
      "allowed_reason_families": [
        "MATCH",
        "POLICY"
      ],
      "required_expected_fields": [
        "causal_strength",
        "exposure_status"
      ],
      "required_observed_fields": [
        "causal_strength",
        "exposure_status"
      ],
      "not_applicable_allowed": true,
      "hard_safety_failure_possible": true
    },
    {
      "claim_type": "uncertainty",
      "validator_family": "UNCERTAINTY",
      "allowed_statuses": [
        "SUPPORTED",
        "UNSUPPORTED",
        "CONTRADICTED",
        "NOT_VERIFIABLE"
      ],
      "allowed_reason_families": [
        "MATCH",
        "UNCERTAINTY",
        "POLICY"
      ],
      "required_expected_fields": [
        "certainty",
        "exposure_status"
      ],
      "required_observed_fields": [
        "certainty",
        "exposure_status"
      ],
      "not_applicable_allowed": false,
      "hard_safety_failure_possible": true
    },
    {
      "claim_type": "distributed_evidence",
      "validator_family": "POLICY",
      "allowed_statuses": [
        "SUPPORTED",
        "UNSUPPORTED",
        "NOT_VERIFIABLE",
        "NOT_APPLICABLE"
      ],
      "allowed_reason_families": [
        "MATCH",
        "EXPOSURE",
        "POLICY"
      ],
      "required_expected_fields": [
        "exposure_status"
      ],
      "required_observed_fields": [
        "exposure_status"
      ],
      "not_applicable_allowed": true,
      "hard_safety_failure_possible": false
    },
    {
      "claim_type": "recommendation",
      "validator_family": "POLICY",
      "allowed_statuses": [
        "SUPPORTED",
        "UNSUPPORTED",
        "CONTRADICTED",
        "NOT_VERIFIABLE",
        "NOT_APPLICABLE"
      ],
      "allowed_reason_families": [
        "MATCH",
        "POLICY"
      ],
      "required_expected_fields": [
        "exposure_status"
      ],
      "required_observed_fields": [
        "exposure_status"
      ],
      "not_applicable_allowed": true,
      "hard_safety_failure_possible": true
    },
    {
      "claim_type": "limitation",
      "validator_family": "POLICY",
      "allowed_statuses": [
        "SUPPORTED",
        "UNSUPPORTED",
        "NOT_VERIFIABLE",
        "NOT_APPLICABLE"
      ],
      "allowed_reason_families": [
        "MATCH",
        "POLICY"
      ],
      "required_expected_fields": [
        "exposure_status"
      ],
      "required_observed_fields": [
        "exposure_status"
      ],
      "not_applicable_allowed": true,
      "hard_safety_failure_possible": false
    }
  ]
}
